SQL> UPDATE EMP SET salary=salary+commission;

4 rows updated.

SQL> SELECT * FROM EMP;

     EMPNO ENAME                     JOB              SALARY COMMISSION     DEPTNO DATE_JOIN
---------- ------------------------- ------------ ---------- ---------- ---------- ---------
       100 TOBIN                     analyst           15150        150         21 17-DEC-21
       101 THOMAS                    HACKER            25250        250         25 15-DEC-20
       102 MANU                      analyst           22120        120         24 22-JAN-21
       103 JERRY                     ENGINEER          21160        160         27 18-NOV-20




SQL> ALTER TABLE EMP DROP(commission);

Table altered.

SQL> SELECT * FROM EMP;

     EMPNO ENAME                     JOB              SALARY     DEPTNO DATE_JOIN
---------- ------------------------- ------------ ---------- ---------- ---------
       100 TOBIN                     analyst           15150         21 17-DEC-21
       101 THOMAS                    HACKER            25250         25 15-DEC-20
       102 MANU                      analyst           22120         24 22-JAN-21
       103 JERRY                     ENGINEER          21160         27 18-NOV-20


SQL> UPDATE EMP SET salary=25250 WHERE empno=103;

1 row updated.

SQL> SELECT * FROM EMP;

     EMPNO ENAME                     JOB              SALARY     DEPTNO DATE_JOIN
---------- ------------------------- ------------ ---------- ---------- ---------
       100 TOBIN                     analyst           15150         21 17-DEC-21
       101 THOMAS                    HACKER            25250         25 15-DEC-20
       102 MANU                      analyst           22120         24 22-JAN-21
       103 JERRY                     ENGINEER          25250         27 18-NOV-20


SQL> ALTER TABLE EMP RENAME COLUMN ename TO empname;

Table altered.

SQL> ALTER TABLE EMP RENAME COLUMN empno To empid;

Table altered.

SQL> SELECT * FROM EMP;

     EMPID EMPNAME                   JOB              SALARY     DEPTNO DATE_JOIN
---------- ------------------------- ------------ ---------- ---------- ---------
       100 TOBIN                     analyst           15150         21 17-DEC-21
       101 THOMAS                    HACKER            25250         25 15-DEC-20
       102 MANU                      analyst           22120         24 22-JAN-21
       103 JERRY                     ENGINEER          25250         27 18-NOV-20



SQL> SELECT E1.empname,E2.salary FROM EMP E1, EMP E2 WHERE E1.salary=E2.SALARY AND E1.EMPNAME<>E2.EMPNAME;

EMPNAME                       SALARY
------------------------- ----------
JERRY                          25250
THOMAS                         25250

SQL>